{
  "candidate_count": 50,
  "candidate_pool": [
    {
      "entry_reasons": [
        "ALL_STRICTLY_EARLIER_SAME_REPOSITORY_HISTORY"
      ],
      "memory": {
        "claim": "Earlier task experience concerned: ccode(sinc(x)) doesn't work ``` In [30]: ccode(sinc(x)) Out[30]: '// Not supported in C:\\n// sinc\\nsinc(x)' ``` I don't think `math.h` has `sinc`, but it could print ``` In [38]: ccode(Piecewise((sin(theta)/theta, Ne(theta, 0)), (1, True))) Out[38]: '((Ne(theta, 0)) ? (\\n sin(theta)/theta\\n)\\n: (\\n 1\\n))' ```. Its reference change touched: sympy/printing/ccode.py.",
        "created_at": "2016-07-15T21:40:49Z",
        "evidence": [
          "ccode(sinc(x)) doesn't work ``` In [30]: ccode(sinc(x)) Out[30]: '// Not supported in C:\\n// sinc\\nsinc(x)' ``` I don't think `math.h` has `sinc`, but it could print ``` In [38]: ccode(Piecewise((sin(theta)/theta, Ne(theta, 0)), (1, True))) Out[38]: '((Ne(theta, 0)) ? (\\n sin(theta)/theta\\n)\\n: (\\n 1\\n))' ```"
        ],
        "evidence_locations": [
          "sympy/printing/ccode.py"
        ],
        "extractor_version": "provided-experience-metadata-v1",
        "files_or_symbols": [
          "sympy/printing/ccode.py"
        ],
        "generality": null,
        "memory_id": "1fcc60cf20f9678dff008714",
        "memory_type": "EPISODIC_EXAMPLE",
        "negative_transfer_risk": null,
        "preconditions": "Inspect the current target code and tests; this is a prior task example, not a prescription.",
        "provenance_hash": "47de72199670674ff2e701194214aea14aba78adc44a4f5953cf708a28934cdc",
        "repository": "sympy/sympy",
        "scope": {
          "paths": [
            "sympy/printing/ccode.py"
          ],
          "repository": "sympy/sympy"
        },
        "source_mode": "PROVIDED_EXPERIENCE_SMOKE",
        "source_outcome": {
          "evidence_status": "reference_patch_available_not_agent_outcome",
          "status": "unknown"
        },
        "source_task_id": "sympy__sympy-11400",
        "source_worker_id": null
      },
      "public_similarity": {
        "shared_issue_terms": [],
        "shared_paths_in_issue_text": [],
        "shared_symbols_in_issue_text": [],
        "temporal_distance_days": 1385.703
      }
    },
    {
      "entry_reasons": [
        "ALL_STRICTLY_EARLIER_SAME_REPOSITORY_HISTORY"
      ],
      "memory": {
        "claim": "Earlier task experience concerned: simplifying exponential -> trig identities ``` f = 1 / 2 * (-I*exp(I*k) + I*exp(-I*k)) trigsimp(f) ``` Ideally, this would yield `sin(k)`. Is there a way to do this? As a corollary, it would be awesome if ``` f = 1 / 2 / k* (-I*exp(I*k) + I*exp(-I*k)) trigsimp(f) ``` could yield `sinc(k)`. Thank you for your…. Its reference change touched: sympy/functions/elementary/trigonometric.py.",
        "created_at": "2016-11-17T21:36:03Z",
        "evidence": [
          "simplifying exponential -> trig identities ``` f = 1 / 2 * (-I*exp(I*k) + I*exp(-I*k)) trigsimp(f) ``` Ideally, this would yield `sin(k)`. Is there a way to do this? As a corollary, it would be awesome if ``` f = 1 / 2 / k* (-I*exp(I*k) + I*exp(-I*k)) trigsimp(f) ``` could yield `sinc(k)`. Thank you for your…"
        ],
        "evidence_locations": [
          "sympy/functions/elementary/trigonometric.py"
        ],
        "extractor_version": "provided-experience-metadata-v1",
        "files_or_symbols": [
          "sympy/functions/elementary/trigonometric.py"
        ],
        "generality": null,
        "memory_id": "e8c774b6b83aece548462e9a",
        "memory_type": "EPISODIC_EXAMPLE",
        "negative_transfer_risk": null,
        "preconditions": "Inspect the current target code and tests; this is a prior task example, not a prescription.",
        "provenance_hash": "d9132c0d2875adc1574fe305ae88aec1ebeb9b5cab0ccc8fd865b165da835f84",
        "repository": "sympy/sympy",
        "scope": {
          "paths": [
            "sympy/functions/elementary/trigonometric.py"
          ],
          "repository": "sympy/sympy"
        },
        "source_mode": "PROVIDED_EXPERIENCE_SMOKE",
        "source_outcome": {
          "evidence_status": "reference_patch_available_not_agent_outcome",
          "status": "unknown"
        },
        "source_task_id": "sympy__sympy-11870",
        "source_worker_id": null
      },
      "public_similarity": {
        "shared_issue_terms": [
          "trig"
        ],
        "shared_paths_in_issue_text": [],
        "shared_symbols_in_issue_text": [],
        "temporal_distance_days": 1260.707
      }
    },
    {
      "entry_reasons": [
        "ALL_STRICTLY_EARLIER_SAME_REPOSITORY_HISTORY",
        "ISSUE_TEXT_OVERLAP"
      ],
      "memory": {
        "claim": "Earlier task experience concerned: LaTeX printer inconsistent with pretty printer The LaTeX printer should always give the same output as the pretty printer, unless better output is possible from LaTeX. In some cases it is inconsistent. For instance: ``` py In [9]: var('x', positive=True) Out[9]: x In [10]: latex(exp(-x)*log(x)) Out[10]:…. Its reference change touched: sympy/printing/latex.py.",
        "created_at": "2016-12-03T14:40:51Z",
        "evidence": [
          "LaTeX printer inconsistent with pretty printer The LaTeX printer should always give the same output as the pretty printer, unless better output is possible from LaTeX. In some cases it is inconsistent. For instance: ``` py In [9]: var('x', positive=True) Out[9]: x In [10]: latex(exp(-x)*log(x)) Out[10]:…"
        ],
        "evidence_locations": [
          "sympy/printing/latex.py"
        ],
        "extractor_version": "provided-experience-metadata-v1",
        "files_or_symbols": [
          "sympy/printing/latex.py"
        ],
        "generality": null,
        "memory_id": "5d7dc4296e585fcb57f2db91",
        "memory_type": "EPISODIC_EXAMPLE",
        "negative_transfer_risk": null,
        "preconditions": "Inspect the current target code and tests; this is a prior task example, not a prescription.",
        "provenance_hash": "72399c809fb4000f0d7329073bbe9212474519f4deb3987dd209d30933f92f8b",
        "repository": "sympy/sympy",
        "scope": {
          "paths": [
            "sympy/printing/latex.py"
          ],
          "repository": "sympy/sympy"
        },
        "source_mode": "PROVIDED_EXPERIENCE_SMOKE",
        "source_outcome": {
          "evidence_status": "reference_patch_available_not_agent_outcome",
          "status": "unknown"
        },
        "source_task_id": "sympy__sympy-11897",
        "source_worker_id": null
      },
      "public_similarity": {
        "shared_issue_terms": [
          "latex",
          "printer",
          "printing"
        ],
        "shared_paths_in_issue_text": [],
        "shared_symbols_in_issue_text": [],
        "temporal_distance_days": 1244.995
      }
    },
    {
      "entry_reasons": [
        "ALL_STRICTLY_EARLIER_SAME_REPOSITORY_HISTORY",
        "ISSUE_TEXT_OVERLAP"
      ],
      "memory": {
        "claim": "Earlier task experience concerned: matematica code printer does not handle floats and derivatives correctly In its current state the mathematica code printer does not handle Derivative(func(vars), deriver) e.g. Derivative(f(t), t) yields Derivative(f(t), t) instead of D[f[t],t] Also floats with exponents are not handled correctly e.g. 1.0e-4 is not…. Its reference change touched: sympy/printing/mathematica.py.",
        "created_at": "2017-02-13T18:20:56Z",
        "evidence": [
          "matematica code printer does not handle floats and derivatives correctly In its current state the mathematica code printer does not handle Derivative(func(vars), deriver) e.g. Derivative(f(t), t) yields Derivative(f(t), t) instead of D[f[t],t] Also floats with exponents are not handled correctly e.g. 1.0e-4 is not…"
        ],
        "evidence_locations": [
          "sympy/printing/mathematica.py"
        ],
        "extractor_version": "provided-experience-metadata-v1",
        "files_or_symbols": [
          "sympy/printing/mathematica.py"
        ],
        "generality": null,
        "memory_id": "a8f1c380cdd35b4b004f5d79",
        "memory_type": "EPISODIC_EXAMPLE",
        "negative_transfer_risk": null,
        "preconditions": "Inspect the current target code and tests; this is a prior task example, not a prescription.",
        "provenance_hash": "19e9d1989ba520af5c6c7717350d52afda477d533d1afaaa458c979f54450fcd",
        "repository": "sympy/sympy",
        "scope": {
          "paths": [
            "sympy/printing/mathematica.py"
          ],
          "repository": "sympy/sympy"
        },
        "source_mode": "PROVIDED_EXPERIENCE_SMOKE",
        "source_outcome": {
          "evidence_status": "reference_patch_available_not_agent_outcome",
          "status": "unknown"
        },
        "source_task_id": "sympy__sympy-12171",
        "source_worker_id": null
      },
      "public_similarity": {
        "shared_issue_terms": [
          "correctly",
          "printer"
        ],
        "shared_paths_in_issue_text": [],
        "shared_symbols_in_issue_text": [],
        "temporal_distance_days": 1172.842
      }
    },
    {
      "entry_reasons": [
        "ALL_STRICTLY_EARLIER_SAME_REPOSITORY_HISTORY"
      ],
      "memory": {
        "claim": "Earlier task experience concerned: Wrong result with apart ``` Python 3.6.0 |Continuum Analytics, Inc.| (default, Dec 23 2016, 12:22:00) Type \"copyright\", \"credits\" or \"license\" for more information. IPython 5.1.0 -- An enhanced Interactive Python. ? -> Introduction and overview of IPython's features. %quickref -> Quick reference. help -> Python's own…. Its reference change touched: sympy/polys/domains/polynomialring.py.",
        "created_at": "2017-03-01T14:52:16Z",
        "evidence": [